{
  "releaseId": "EXAMPLE-NOT-REAL",
  "sourceCommitSha": "0000000000000000000000000000000000000000",
  "artifactDigest": "EXAMPLE-NOT-REAL",
  "environment": "staging",
  "approvedBy": "NOT_APPROVED",
  "approvedAt": "2026-10-23T00:00:00Z",
  "migrationRevision": null,
  "smokeChecks": [
    {
      "id": "DO36-001",
      "result": "NOT_RUN",
      "evidenceUri": null
    }
  ]
}